{"apiVersion":"brain-role.dev/v1alpha2","compileOrder":["brainstem","cerebellum","hippocampus","amygdala","cerebral-cortex","prefrontal-cortex","default-mode-network"],"kind":"CompiledBrainRole","layers":[{"apiVersion":"brain-role.dev/v1alpha2","kind":"LayerManifest","metadata":{"classification":"PUBLIC","id":"brainstem-layer","version":"0.1.1"},"spec":{"brainstemCore":["truth-non-fabrication","safety-security","provenance-no-loss","deterministic-transition","no-higher-layer-override"],"changeControl":{"approval":"out-of-band-new-identity","effectiveAt":"2026-07-31T00:00:00Z","provenance":"spec://layers/brainstem","rollback":"new-identity-only"},"classification":"PUBLIC","dependencies":[],"layer":"brainstem","mutability":"immutable","owner":"synthetic-architecture-maintainers","responsibilities":["truth-and-non-fabrication","safety-and-security","provenance-and-no-loss","deterministic-transition","deny-higher-layer-override"],"status":"active"}},{"apiVersion":"brain-role.dev/v1alpha2","kind":"LayerManifest","metadata":{"classification":"PUBLIC","id":"cerebellum-layer","version":"0.1.0"},"spec":{"changeControl":{"approval":"maintainer-review","effectiveAt":"2026-07-31T00:00:00Z","provenance":"spec://layers/cerebellum","rollback":"restore-prior-reviewed-manifest"},"classification":"PUBLIC","dependencies":["brainstem"],"layer":"cerebellum","mutability":"controlled","owner":"synthetic-architecture-maintainers","responsibilities":[],"status":"reserved"}},{"apiVersion":"brain-role.dev/v1alpha2","kind":"LayerManifest","metadata":{"classification":"PUBLIC","id":"hippocampus-layer","version":"0.1.0"},"spec":{"changeControl":{"approval":"maintainer-review","effectiveAt":"2026-07-31T00:00:00Z","provenance":"spec://layers/hippocampus","rollback":"restore-prior-reviewed-manifest"},"classification":"PUBLIC","dependencies":["brainstem"],"layer":"hippocampus","mutability":"controlled","owner":"synthetic-architecture-maintainers","responsibilities":["synthetic-durable-state-contract"],"status":"active"}},{"apiVersion":"brain-role.dev/v1alpha2","kind":"LayerManifest","metadata":{"classification":"PUBLIC","id":"amygdala-layer","version":"0.1.0"},"spec":{"changeControl":{"approval":"maintainer-review","effectiveAt":"2026-07-31T00:00:00Z","provenance":"spec://layers/amygdala","rollback":"restore-prior-reviewed-manifest"},"classification":"PUBLIC","dependencies":["brainstem"],"layer":"amygdala","mutability":"controlled","owner":"synthetic-architecture-maintainers","responsibilities":[],"status":"reserved"}},{"apiVersion":"brain-role.dev/v1alpha2","kind":"LayerManifest","metadata":{"classification":"PUBLIC","id":"cerebral-cortex-layer","version":"0.1.0"},"spec":{"changeControl":{"approval":"maintainer-review","effectiveAt":"2026-07-31T00:00:00Z","provenance":"spec://layers/cerebral-cortex","rollback":"restore-prior-reviewed-manifest"},"classification":"PUBLIC","dependencies":["brainstem","hippocampus"],"layer":"cerebral-cortex","mutability":"controlled","owner":"synthetic-architecture-maintainers","responsibilities":["deterministic-workflow-orchestration"],"status":"active"}},{"apiVersion":"brain-role.dev/v1alpha2","kind":"LayerManifest","metadata":{"classification":"PUBLIC","id":"prefrontal-cortex-layer","version":"0.1.0"},"spec":{"changeControl":{"approval":"maintainer-review","effectiveAt":"2026-07-31T00:00:00Z","provenance":"spec://layers/prefrontal-cortex","rollback":"restore-prior-reviewed-manifest"},"classification":"PUBLIC","dependencies":["brainstem","hippocampus","cerebral-cortex"],"layer":"prefrontal-cortex","mutability":"controlled","owner":"synthetic-architecture-maintainers","responsibilities":["bounded-goals-and-stop-criteria"],"status":"active"}},{"apiVersion":"brain-role.dev/v1alpha2","kind":"LayerManifest","metadata":{"classification":"PUBLIC","id":"default-mode-network-layer","version":"0.1.0"},"spec":{"changeControl":{"approval":"maintainer-review","effectiveAt":"2026-07-31T00:00:00Z","provenance":"spec://layers/default-mode-network","rollback":"restore-prior-reviewed-manifest"},"classification":"PUBLIC","dependencies":["brainstem","hippocampus","cerebral-cortex"],"layer":"default-mode-network","mutability":"controlled","owner":"synthetic-architecture-maintainers","responsibilities":["accessible-public-communication"],"status":"active"}}],"metadata":{"architectureId":"bra-minimal-public","classification":"PUBLIC","id":"minimal-public","version":"0.1.1"},"policies":[{"apiVersion":"brain-role.dev/v1alpha2","kind":"PolicyManifest","metadata":{"classification":"PUBLIC","id":"brainstem-protection","version":"0.1.0"},"spec":{"denyRoleWrites":["brainstem"],"denySelfEscalation":true,"secretRefPattern":"^env://[A-Z][A-Z0-9_]{2,127}$"}}],"roles":[{"apiVersion":"brain-role.dev/v1alpha2","kind":"RoleManifest","metadata":{"classification":"PUBLIC","id":"synthetic-observer","version":"0.1.0"},"spec":{"capabilities":["architecture.read"],"escalation":"maintainer-review","failureMode":"stop","fallbackPolicy":"remain read-only","forbiddenLayers":["brainstem"],"inputs":["validated-instance"],"networkPolicy":"deny","outputs":["conformance-summary"],"owner":"synthetic-architecture-maintainers","purpose":"Inspect a synthetic public architecture without mutation.","readLayers":["brainstem","cerebellum","hippocampus","amygdala","cerebral-cortex","default-mode-network","prefrontal-cortex"],"selfEscalation":false,"stateScope":"none","writeLayers":[]}},{"apiVersion":"brain-role.dev/v1alpha2","kind":"RoleManifest","metadata":{"classification":"PUBLIC","id":"synthetic-operator","version":"0.1.0"},"spec":{"capabilities":["state.propose","workflow.execute"],"escalation":"maintainer-review","failureMode":"stop","fallbackPolicy":"stop without mutation","forbiddenLayers":["brainstem","cerebellum","amygdala","default-mode-network"],"inputs":["approved-goal","validated-state"],"networkPolicy":"deny","outputs":["provenanced-result"],"owner":"synthetic-architecture-maintainers","purpose":"Execute bounded synthetic workflows under brainstem constraints.","readLayers":["brainstem","hippocampus","cerebral-cortex","prefrontal-cortex"],"selfEscalation":false,"stateScope":"task","writeLayers":["hippocampus","cerebral-cortex","prefrontal-cortex"]}}]}
